{
  "version": 2,
  "updated_at": "2026-10-14T01:07:03+00:00",
  "rotation_cursor": 0,
  "loops": {
    "repo-closed-loop": {
      "last_run": "2026-09-23T15:25:00+00:00",
      "status": "retired",
      "consecutive_failures": 0,
      "notes": "Retired 2026-09-23; replaced by cloud-improvements."
    },
    "repo-review-loop": {
      "last_run": null,
      "status": "retired",
      "consecutive_failures": 0,
      "notes": "Retired 2026-09-23; replaced by cloud-maintenance."
    },
    "repo-open-loop": {
      "last_run": "2026-08-22T00:00:00+00:00",
      "status": "retired",
      "consecutive_failures": 0,
      "notes": "Retired 2026-09-23; replaced by cloud-creative."
    },
    "repo-genesis-loop": {
      "last_run": "2026-09-02T19:01:07+00:00",
      "status": "idle",
      "consecutive_failures": 0,
      "notes": "Unpaused by owner 2026-09-23 (explicit 'unpause' instruction). Previously paused pending the 2d crash test; owner confirmed lifting it. Next real gate is still the 28-day anchor (day 35 of 28 as of 2026-09-23, next eligible 2026-10-14) and the min_days_between_runs lease (last_run 2026-09-02, min 27d, next eligible 2026-09-29)."
    },
    "loop-engine-digest": {
      "last_run": null,
      "status": "retired",
      "consecutive_failures": 0,
      "notes": "Retired 2026-09-23; replaced by cloud-weekly-summary."
    },
    "repo-backlog-refresh": {
      "last_run": "2026-08-29T08:16:22+00:00",
      "status": "retired",
      "consecutive_failures": 0,
      "notes": "Retired 2026-09-23; replaced by cloud-improvements."
    },
    "kinz-competitor-analyst": {
      "last_run": null,
      "status": "retired",
      "consecutive_failures": 0,
      "notes": "Retired 2026-09-23; replaced by cloud-kinz-analyst."
    },
    "cloud-kinz-improvement": {
      "last_run": "2026-10-13T01:32:10Z",
      "status": "idle",
      "consecutive_failures": 0
    },
    "cloud-daily-commit": {
      "last_run": "2026-10-13T05:49:30Z",
      "status": "idle",
      "consecutive_failures": 0
    },
    "cloud-weekly-status": {
      "last_run": null,
      "status": "retired",
      "consecutive_failures": 0,
      "notes": "Retired 2026-09-23; replaced by cloud-weekly-summary."
    },
    "cloud-maintenance": {
      "last_run": "2026-10-14T00:53:41Z",
      "status": "idle",
      "consecutive_failures": 0
    },
    "cloud-improvements": {
      "last_run": "2026-10-14T01:07:03Z",
      "status": "idle",
      "consecutive_failures": 0
    },
    "cloud-creative": {
      "last_run": "2026-10-10T01:24:00Z",
      "status": "idle",
      "consecutive_failures": 0
    },
    "cloud-weekly-summary": {
      "last_run": "2026-10-12T05:55:28Z",
      "status": "idle",
      "consecutive_failures": 0
    },
    "cloud-kinz-analyst": {
      "last_run": "2026-10-13T01:18:17Z",
      "status": "idle",
      "consecutive_failures": 0
    }
  }
}
